{
  "competitor_analysis": [
    {
      "source_name": "Mass.gov (EOEA)",
      "source_url": "https://www.mass.gov/assisted-living-residences",
      "key_metrics_provided": [
        { "value": "Certification Status", "source_url": "https://www.mass.gov/assisted-living-residences" },
        { "value": "Total Units", "source_url": "https://www.mass.gov/assisted-living-residences/locations" },
        { "value": "Low Income Options (Yes/No)", "source_url": "https://www.mass.gov/assisted-living-residences/locations" }
      ],
      "unique_features": [
        { "value": "Interactive Map of Certified ALRs", "source_url": "https://www.mass.gov/assisted-living-residences/locations" },
        { "value": "Annual ALR Data Reports", "source_url": "https://www.mass.gov/lists/annual-assisted-living-residence-alr-data-reports" }
      ],
      "data_gaps": [
        { "value": "Real-time pricing data", "source_url": "https://www.mass.gov/assisted-living-residences/locations" },
        { "value": "Searchable inspection/violation details online", "source_url": "https://americancaregiverassociation.org/how-to-check-for-assisted-living-violations-2/" }
      ],
      "update_frequency": "Annual for data reports; Bi-annual for inspections",
      "monetization_model": "Publicly Funded (State Agency)",
      "backlink_partners": [
        { "value": "MassHealth", "source_url": "https://www.mass.gov/assisted-living-residences" }
      ]
    },
    {
      "source_name": "A Place for Mom",
      "source_url": "https://www.aplaceformom.com/assisted-living/massachusetts",
      "key_metrics_provided": [
        { "value": "Median Monthly Cost", "source_url": "https://www.aplaceformom.com/assisted-living/massachusetts" },
        { "value": "Cost by Floor Plan (Studio/1BR/2BR)", "source_url": "https://www.aplaceformom.com/senior-living-data/long-term-care-costs" }
      ],
      "unique_features": [
        { "value": "Proprietary family move-in cost data", "source_url": "https://www.aplaceformom.com/senior-living-data/long-term-care-costs" },
        { "value": "Senior Living Cost Calculator", "source_url": "https://www.aplaceformom.com/paying-for-senior-care/cost-calculator" }
      ],
      "data_gaps": [
        { "value": "Detailed regulatory compliance records", "source_url": "https://www.aplaceformom.com/assisted-living/massachusetts" },
        { "value": "Specific SCO/PACE availability per facility", "source_url": "https://www.aplaceformom.com/assisted-living/massachusetts" }
      ],
      "ranking_keywords": [
        { "value": "Assisted living costs Massachusetts", "source_url": "https://www.aplaceformom.com/assisted-living/massachusetts" }
      ],
      "monetization_model": "Referral Fees (Partner Communities)"
    },
    {
      "source_name": "Caring.com",
      "source_url": "https://www.caring.com/senior-living/assisted-living/massachusetts",
      "key_metrics_provided": [
        { "value": "User Reviews & Ratings", "source_url": "https://www.caring.com/senior-living/assisted-living/massachusetts" },
        { "value": "Service Availability (Housekeeping/Nursing)", "source_url": "https://www.caring.com/senior-living/assisted-living" }
      ],
      "unique_features": [
        { "value": "Family Advisor Guidance", "source_url": "https://www.caring.com/" },
        { "value": "Aggregated review data", "source_url": "https://www.caring.com/" }
      ],
      "content_formats": [
        { "value": "Personalized Community Lists", "source_url": "https://www.caring.com/" }
      ],
      "monetization_model": "Referral Fees"
    },
    {
      "source_name": "Seniorly",
      "source_url": "https://www.seniorly.com/assisted-living/massachusetts",
      "key_metrics_provided": [
        { "value": "Seniorly Price Estimate", "source_url": "https://www.seniorly.com/" },
        { "value": "Neighborhood Insights", "source_url": "https://www.seniorly.com/" }
      ],
      "content_formats": [
        { "value": "Senior living cost calculator", "source_url": "https://www.seniorly.com/" }
      ],
      "monetization_model": "Referral Fees"
    },
    {
      "source_name": "MASS-ALA",
      "source_url": "https://mass-ala.org/resource-guide/",
      "key_metrics_provided": [
        { "value": "Certified Residences List", "source_url": "https://mass-ala.org/resource-guide/" }
      ],
      "unique_features": [
        { "value": "Assisted Living Resource Guide", "source_url": "https://mass-ala.org/resource-guide/" },
        { "value": "Consumer Information Checklist", "source_url": "http://www.mass-ala.org/wp-content/uploads/2017/07/Consumer-Information-Checklist_2017.pdf" }
      ],
      "monetization_model": "Membership Dues"
    },
    {
      "source_name": "US News & World Report",
      "source_url": "https://health.usnews.com/best-senior-living/assisted-living/massachusetts",
      "key_metrics_provided": [
        { "value": "Best Senior Living Ratings", "source_url": "https://health.usnews.com/best-senior-living/assisted-living/massachusetts" }
      ],
      "monetization_model": "Ads and Affiliate Referral",
      "backlink_partners": [
        { "value": "National Institute on Aging", "source_url": "https://health.usnews.com/best-senior-living/assisted-living/massachusetts" }
      ]
    },
    {
      "source_name": "AssistedLiving.org",
      "source_url": "https://www.assistedliving.org/massachusetts/",
      "key_metrics_provided": [
        { "value": "Finance Options (Medicaid/VA/SSI)", "source_url": "https://www.assistedliving.org/massachusetts/" }
      ],
      "monetization_model": "Ads and Referral Fees"
    },
    {
      "source_name": "SeniorAdvice.com",
      "source_url": "https://www.senioradvice.com/assisted-living/massachusetts",
      "key_metrics_provided": [
        { "value": "SeniorScore", "source_url": "https://www.senioradvice.com/assisted-living/massachusetts" }
      ],
      "monetization_model": "Lead Generation"
    },
    {
      "source_name": "Assisted Living Locators",
      "source_url": "https://assistedlivinglocators.com/",
      "key_metrics_provided": [
        { "value": "Advisor-led placement data", "source_url": "https://assistedlivinglocators.com/" }
      ],
      "monetization_model": "Franchise Referral Fees"
    },
    {
      "source_name": "Family Assets",
      "source_url": "https://www.familyassets.com/assisted-living/massachusetts",
      "key_metrics_provided": [
        { "value": "Financial Planning Tools", "source_url": "https://www.familyassets.com/" }
      ],
      "monetization_model": "Lead Generation"
    }
  ],
  "proposed_firecrawl_metrics": [
    {
      "metric_name": "Violation Severity Index",
      "metric_url": "https://www.mass.gov/lists/annual-assisted-living-residence-alr-data-reports",
      "description": "A calculated score based on public state inspection reports, weighing frequency and severity of violations to surface risk-adjusted facility comparisons.",
      "data_source_type": "State regulatory PDFs and public inspection report portals",
      "crawl_target_urls": [
        { "value": "https://www.mass.gov/doc/list-of-certified-assisted-living-residences-as-of-april-2025/download" }
      ],
      "refresh_cadence": "Monthly (for report tracking)",
      "data_freshness_risk": "High - state reports are updated bi-annually but new violations can occur anytime.",
      "authority_impact": "Positions assistedly.ai as a translator of dense regulatory filings into actionable consumer scores."
    },
    {
      "metric_name": "True Cost to Care Matrix",
      "metric_url": "https://www.aplaceformom.com/senior-living-data/long-term-care-costs",
      "description": "Combining base rent with Level 1-4 care fees extracted from facility websites to expose all-in monthly costs rather than advertised starting rates.",
      "data_source_type": "Facility websites, pricing pages, and PDF rate sheets",
      "crawl_target_urls": [
        { "value": "https://www.atriaseniorliving.com/senior-living-communities/senior-living-in-massachusetts" },
        { "value": "https://www.brightviewseniorliving.com/types-of-living/massachusetts-assisted-living" }
      ],
      "refresh_cadence": "Monthly",
      "data_freshness_risk": "Medium - pricing changes typically occur annually but discounts are seasonal.",
      "authority_impact": "Reveals hidden costs that referral sites smooth over, building direct consumer trust."
    },
    {
      "metric_name": "SCO/PACE Availability Status",
      "metric_url": "https://www.mass.gov/senior-care-options",
      "description": "Real-time tracking of whether a facility currently accepts Senior Care Options or PACE slots based on program enrollment pages and provider directories.",
      "data_source_type": "MassHealth program pages, provider directories, plan websites",
      "crawl_target_urls": [
        { "value": "https://mass-ala.org/payment-options-in-assisted-living/" }
      ],
      "refresh_cadence": "Weekly",
      "data_freshness_risk": "High - Medicaid waiver slots are limited and fill quickly.",
      "authority_impact": "Solves a high-intent, high-anxiety search query that no single aggregator currently answers accurately."
    },
    {
      "metric_name": "Staffing Volatility Proxy",
      "description": "Tracks sudden changes in listed staff roles and leadership on facility websites (e.g., new Director of Nursing within 6 months, dropped CNA hiring posts) to serve as an early proxy for staffing instability before it appears in state records.",
      "data_source_type": "Facility careers pages, leadership pages, and job board postings",
      "crawl_target_urls": [
        { "value": "https://www.indeed.com/jobs?q=assisted+living&l=Massachusetts" }
      ],
      "refresh_cadence": "Weekly",
      "data_freshness_risk": "Medium - turnover spikes correlate to inspection findings but are faster to detect via crawl.",